{
  "schema_version": "1.0",
  "contract_name": "execution-request",
  "request_id": "synthetic-request-001",
  "created_utc": "2026-07-18T22:00:00Z",
  "requested_by": {
    "actor_type": "agent",
    "actor_id": "synthetic-routing-agent",
    "role": "requester"
  },
  "workflow_plan_ref": {
    "contract_name": "workflow-plan",
    "schema_version": "1.0",
    "record_id": "synthetic-plan-001",
    "sha256": "aaaaaaaaaaaaaaaaaaaaaaaaaaaaaaaaaaaaaaaaaaaaaaaaaaaaaaaaaaaaaaaa",
    "role": "workflow-plan"
  },
  "workflow_step_id": "synthetic-step-001",
  "operation_id": "audit-and-run-scf",
  "execution_mode": "execute",
  "command_kind": "argv",
  "shell": false,
  "argv": ["pw.x", "-in", "scf.in"],
  "working_directory_label": "synthetic-campaign/run-001",
  "environment_profile_id": "synthetic-qe-env-001",
  "resources": {
    "scheduler_profile_id": "synthetic-slurm-001",
    "nodes": 1,
    "mpi_ranks": 1,
    "threads_per_rank": 1,
    "gpus": 0,
    "memory_mb": 4096,
    "walltime_s": 900
  },
  "inputs": [
    {
      "role": "main-input",
      "label": "scf.in",
      "media_type": "text/plain",
      "format": "qe-input",
      "format_version": "1.0",
      "availability": "present",
      "sha256": "bbbbbbbbbbbbbbbbbbbbbbbbbbbbbbbbbbbbbbbbbbbbbbbbbbbbbbbbbbbbbbbb",
      "bytes": 256,
      "sensitivity": "public",
      "redistribution": "redistributable"
    }
  ],
  "expected_outputs": [
    {
      "role": "main-output",
      "label": "qe-output.log",
      "media_type": "text/plain",
      "format": "qe-output",
      "format_version": "1.0",
      "availability": "missing",
      "sha256": null,
      "bytes": null,
      "sensitivity": "public",
      "redistribution": "redistributable"
    }
  ],
  "parent_records": [],
  "timeout_s": 900,
  "retry_policy": {
    "maximum_attempts": 1,
    "automatic_retry": false,
    "retryable_finding_codes": []
  },
  "authorization_requirement": {
    "required": true,
    "side_effects": ["scheduler-submit"],
    "scope_labels": ["synthetic-campaign/run-001"],
    "reason": "Render one synthetic scheduler request without submitting it."
  },
  "state": "prepared",
  "blocker_codes": [],
  "gates": {
    "status": "pass",
    "maximum_action": "request-execution-authorization",
    "claim_ceiling": "input_gates_only",
    "checks": [
      {
        "check_id": "synthetic-request-gate",
        "status": "pass",
        "decisive": true,
        "finding_codes": [],
        "evidence_refs": [],
        "validated_by": {
          "actor_type": "deterministic-tool",
          "actor_id": "synthetic-validator",
          "role": "validator"
        },
        "validated_utc": "2026-07-18T22:00:00Z",
        "limitations": ["Synthetic request fixture only."]
      }
    ]
  },
  "producer": {
    "skill_id": "dft-project-orchestrator",
    "skill_version": "0.1.0-candidate",
    "tool_id": "synthetic-request-builder",
    "tool_version": "1.0",
    "generated_utc": "2026-07-18T22:00:00Z"
  }
}
